"Name","Source","Page","Rarity","Type","Attunement","Damage","Properties","Mastery","Weight","Value","Text"
"Hunting Trap","PHB'24","226","none","adventuring gear","","","","","25 lb.","5 gp","As a Utilize action, you can set a Hunting Trap, which is a sawtooth steel ring that snaps shut when a creature steps on a pressure plate in the center. The trap is affixed by a heavy chain to an immobile object, such as a tree or a spike driven into the ground. A creature that steps on the plate must succeed on a DC 13 Dexterity saving throw or take 1d4 Piercing damage and have its Speed reduced to 0 until the start of its next turn. Thereafter, until the creature breaks free of the trap, its movement is limited by the length of the chain (typically 3 feet). A creature can use its action to make a DC 13 Strength (Athletics) check, freeing itself or another creature within its reach on a success. Each failed check deals 1 Piercing damage to the trapped creature."
"Icewind Dale Trinket","IDRotF","263","none","adventuring gear","","","","","","","Icewind Dale Trinketsd100Trinket01-04A small wooden figurine of a yawning walrus, painted in red and black05-08A pair of scrimshaw cufflinks with an image of a fisherman on a boat engraved on them09-12A small iron key with a frayed blue and gold cord tied to it13-16A small illustrated book of Northlander myths that has pages missing17-20A damaged scrimshaw cameo depicting a merfolk21-24A stone from a burial cairn with a tiny Dwarvish rune carved into it25-28A ripped cloth sail with a symbol you don't recognize29-32An Ulu knife with a scrimshaw handle33-36A jar containing an unidentifiable, sweet, sticky substance37-40A delicate glass ball painted with snowflakes, capped by a metal loop with a tiny hook attached to it41-44An expedition log with missing pages and a pressed flower used as a bookmark45-48An owl figurine carved from whalebone49-52A sewing box that smells of old wood and has three spools of blue thread inside53-56A scrimshaw-handled ink pen with black runic designs along its length57-60A brooch made from a small insect encased in amber61-64A scrimshaw pepper shaker etched with the letter W65-68An old, wooden-handled ice pick stained with blood that won't wash off69-72A fabric doll bearing an angry expression73-76A set of wind chimes made from seashells77-80A beautiful silver tin that, when opened, emits the smell of rotting fish81-84A bloodstained dreamcatcher made from fishing line, gold wire, and snowy owlbear feathers85-88A figurine of a polar bear made of ice that never melts89-92A snow globe that doesn't need to be shaken93-96A piece of sea glass shaped like a unicorn's horn97-00A dark blue scarf that gets lighter in shade the higher the altitude of the wearer"
"Ink","PHB'24","226","none","adventuring gear","","","","","","10 gp","Ink comes in a 1-ounce bottle, which provides enough ink to write about 500 pages."
"Ink Pen","PHB'24","226","none","adventuring gear","","","","","","2 cp","Using Ink, an Ink Pen is used to write or draw."
"Insect Repellent (block of incense)","ToA","32","none","adventuring gear","","","","","","1 sp","Insect repellent can be purchased in Port Nyanzaru in two forms: blocks of incense or a greasy salve. The merchant prince Kwayothé controls the sale of both. Neither kind of repellent protects against giant insects or the vile swarms of insects described in appendix A of the Monster Manual.When lit, it burns for 8 hours and repels normal insects within a 20-foot-radius centered on it."
"Insect Repellent (greasy salve)","ToA","32","none","adventuring gear","","","","","","1 gp","Insect repellent can be purchased in Port Nyanzaru in two forms: blocks of incense or a greasy salve. The merchant prince Kwayothé controls the sale of both. Neither kind of repellent protects against giant insects or the vile swarms of insects described in appendix A of the Monster Manual.A gourd or vial of salve contains 20 applications of odorless grease. One application protects its wearer against normal insects for 24 hours. The salve is waterproof so it doesn't wash off in rain."
"Iron","DMG'24","213","none","trade good","","","","","1 lb.","1 sp","Merchants commonly exchange trade goods without using currency."
"Iron Ball","IDRotF","238","unknown","weapon, simple weapon, ranged weapon","","1d4 Bludgeoning","finesse, thrown (120 ft.)","","","","This ball is used to play a game of Chain Lightning. Range. A weapon that can be used to make a ranged attack has a range shown in parentheses after the ammunition or thrown property. The range lists two numbers. The first is the weapon's normal range in feet, and the second indicates the weapon's maximum range. When attacking a target beyond normal range, you have disadvantage on the attack roll. You can't attack a target beyond the weapon's long range. Finesse. When making an attack with a finesse weapon, you use your choice of your Strength or Dexterity modifier for the attack and damage rolls. You must use the same modifier for both rolls. Thrown. If a weapon has the thrown property, you can throw the weapon to make a ranged attack. If the weapon is a melee weapon, you use the same ability modifier for that attack roll and damage roll that you would use for a melee attack with the weapon. For example, if you throw a handaxe, you use your Strength, but if you throw a dagger, you can use either your Strength or your Dexterity, since the dagger has the finesse property."
"Iron Pot","PHB'24","228","none","adventuring gear","","","","","10 lb.","2 gp","An Iron Pot holds up to 1 gallon."
"Iron Spike","PHB'24","228","none","adventuring gear","","","","","½ lb.","1 sp","Iron Spikes come in bundles of ten. As a Utilize action, you can use a blunt object, such as a Light Hammer, to hammer a spike into wood, earth, or a similar material. You can do so to jam a door shut or to then tie a Rope or Chain to the Spike."
"Iron Spikes","PHB'24","228","none","adventuring gear","","","","","5 lb.","1 gp","Iron Spikes come in bundles of ten. As a Utilize action, you can use a blunt object, such as a Light Hammer, to hammer a spike into wood, earth, or a similar material. You can do so to jam a door shut or to then tie a Rope or Chain to the Spike."
"Ivana's Whisper","VRGR","83","unknown","adventuring gear, poison (inhaled)","","","","","","","This poison bears a distinct scent and chemical message from Ivana Boritsi. A creature subjected to this poison must succeed on a DC 18 Constitution saving throw or experience the effects of a dream spell created by Ivana the next time they sleep. This poison is nonmagical, and Ivana doesn't directly communicate with those affected during the dream. Rather, she creates the illusion of speaking with her intended target by alchemically crafting her message, predicting her target's reactions, and chemically encoding in her responses. She wears this poison as a perfume or hides it within gift bouquets, allowing it to convey her message later."
"Javelin","PHB'24","215","none","weapon, simple weapon, melee weapon","","1d6 Piercing","Thrown (30/120 ft.)","Mastery: Slow","2 lb.","5 sp","Thrown. If a weapon has the Thrown property, you can throw the weapon to make a ranged attack, and you can draw that weapon as part of the attack. If the weapon is a Melee weapon, use the same ability modifier for the attack and damage rolls that you use for a melee attack with that weapon. Mastery: Slow. If you hit a creature with this weapon and deal damage to it, you can reduce its Speed by 10 feet until the start of your next turn. If the creature is hit more than once by weapons that have this property, the Speed reduction doesn't exceed 10 feet."
"Jeweler's Tools","PHB'24","220","none","artisan's tools","","","","","2 lb.","25 gp","Ability: IntelligenceUtilize: Discern a gem's value (DC 15)Craft: Arcane Focus, Holy SymbolArtisan's Tools are each focused on crafting items and pursuing a trade. Each type of Artisan's Tools tools requires a separate proficiency.If you have proficiency with a tool, add your Proficiency Bonus to any ability check you make that uses the tool. If you have proficiency in a skill that's used with that check, you have Advantage on the check too."
"Jug","PHB'24","226","none","adventuring gear","","","","","4 lb.","2 cp","A Jug holds up to 1 gallon."
"Keelboat","PHB'24","230","none","vehicle (water)","","Speed: 1 mphCarrying Capacity: 1/2 ton cargo, 6 passengersCrew 1, AC 15, HP 100, Damage Threshold 10","","","","3,000 gp","Speed. A ship sailing against a strong wind moves at half speed. In a dead calm (no wind), waterborne ships can't move under sail and must be rowed. Keelboats and Rowboats are used on lakes and rivers. If going downstream, add the speed of the current (typically 3 miles per hour) to the speed of the vehicle. These vehicles can't be rowed against any significant current, but they can be pulled upstream by draft animals on the shores. A Rowboat can be carried and weighs 100 pounds. Crew. A ship larger than a Keelboat or Rowboat needs a crew of skilled hirelings (see ""Services"") to function. The minimum number of skilled hirelings needed to crew a ship depends on the type of ship. Passengers. The number of Small and Medium passengers the ship can accommodate using hammocks. A ship outfitted with private accommodations can carry one-fifth as many passengers. A passenger usually pays 5 SP per day for a hammock, but prices can vary from ship to ship. A small private cabin usually costs 2 GP per day. Damage Threshold. See the rules glossary. Ship Repair. Repairs to a damaged ship can be made while the vessel is berthed. Repairing 1 Hit Point of damage requires 1 day and costs 20 GP for materials and labor. If the repairs are made in a location where supplies and skilled labor are abundant, such as a city shipyard, the repair time and cost are halved."
"Keg of Alchemist's Fire","LoX","35","none","adventuring gear","","","","","","","A keg of alchemist's fire lobbed at a creature or an object deals 21 (6d6) fire damage on a hit. Further, the target is set ablaze and takes the damage again every round (in the case of a creature, at the start of each of its turns) until the fire is put out. A creature within reach of the blaze can take an action to smother the flames using a blanket or carpet, reducing the fire damage by 2d6. Three such actions are needed to fully put out the fire."
"Khyber Trinket","ERLW","135","none","adventuring gear","","","","","","","Trinkets from Khyberd10Trinket1A pressed flower with vivid green petals; when you smell it, you hear eerie music2A tiny ball of putty; if you set it down, it begins to slowly crawl around3A perpetually warm disk of dark iron4A small journal with leathery pages; any words you write in it slowly disappear5A four-sided die carved with strange markings6A cameo with the silhouette of an unknown species7A preserved finger with purple flesh and four joints8A perfectly preserved eye; if you set it down, it rotates to follow your movement9A small box; when opened, you alone hear screaming10A preserved insect; you've never seen another like it"
"Ladder","PHB'24","226","none","adventuring gear","","","","","25 lb.","1 sp","A Ladder is 10 feet tall. You must climb to move up or down it."
"Lamp","PHB'24","226","none","adventuring gear","","","","","1 lb.","5 sp","A Lamp burns Oil as fuel to cast Bright Light in a 15-foot radius and Dim Light for an additional 30 feet."
"Lamprey Ship","AAG","34","none","vehicle (space)","","Speed: 4 mphCarrying Capacity: 6 tons cargoCrew 15, AC 15, HP 250, Damage Threshold 15","","","","20,000 gp","Lamprey ships are antiquated, being among the oldest spelljamming ships still in use. Psurlons (see Boo's Astral Menagerie) are particularly fond of them.Using the metal grappling jaws built into its bow, a lamprey ship can attach itself to another ship, which is a critical feature during boarding actions. Other standard weapons include four ballistae on the main deck.A lamprey can float on water, though it can't land safely on the ground. Lamprey ships that land on the ground have the distressing habit of rolling over, as more than a few crews have discovered to their dismay."
"Lance","PHB'24","215","none","weapon, martial weapon, melee weapon","","1d10 Piercing","Heavy, Reach, Two‑Handed (unless mounted)","Mastery: Topple","6 lb.","10 gp","A Lance requires two hands to wield when you aren't mounted. Heavy. You have Disadvantage on attack rolls with a Heavy weapon if it's a Melee weapon and your Strength score isn't at least 13 or if it's a Ranged weapon and your Dexterity score isn't at least 13. Reach. A Reach weapon adds 5 feet to your reach when you attack with it, as well as when determining your reach for Opportunity Attacks with it. Two-Handed. A Two-Handed weapon requires two hands when you attack with it. Mastery: Topple. If you hit a creature with this weapon, you can force the creature to make a Constitution saving throw (DC 8 plus the ability modifier used to make the attack roll and your Proficiency Bonus). On a failed save, the creature has the Prone condition."
"Leather Armor","PHB'24","219","none","light armor","","AC 11 + Dex","","","10 lb.","10 gp",""
"Leatherworker's Tools","PHB'24","221","none","artisan's tools","","","","","5 lb.","5 gp","Ability: DexterityUtilize: Add a design to a leather item (DC 10)Craft: Sling, Whip, Hide Armor, Leather Armor, Studded Leather Armor, Backpack, Crossbow Bolt Case, Map or Scroll Case, Parchment, Pouch, Quiver, WaterskinArtisan's Tools are each focused on crafting items and pursuing a trade. Each type of Artisan's Tools tools requires a separate proficiency.If you have proficiency with a tool, add your Proficiency Bonus to any ability check you make that uses the tool. If you have proficiency in a skill that's used with that check, you have Advantage on the check too."
"Light Crossbow","PHB'24","215","none","weapon, simple weapon, ranged weapon","","1d8 Piercing","Ammunition (Range 80/320 ft.; Bolt), Loading, Two‑Handed","Mastery: Slow","5 lb.","25 gp","Range. A Range weapon has a range in parentheses after the Ammunition or Thrown property. The range lists two numbers. The first is the weapon's normal range in feet, and the second is the weapon's long range. When attacking a target beyond normal range, you have Disadvantage on the attack roll. You can't attack a target beyond the long range. Ammunition. You can use a weapon that has the Ammunition property to make a ranged attack only if you have ammunition to fire from it. The type of ammunition required is specified with the weapon's range. Each attack expends one piece of ammunition. Drawing the ammunition is part of the attack (you need a free hand to load a one-handed weapon). After a fight, you can spend 1 minute to recover half the ammunition (round down) you used in the fight; the rest is lost. Loading. You can fire only one piece of ammunition from a Loading weapon when you use an action, a Bonus Action, or a Reaction to fire it, regardless of the number of attacks you can normally make. Two-Handed. A Two-Handed weapon requires two hands when you attack with it. Mastery: Slow. If you hit a creature with this weapon and deal damage to it, you can reduce its Speed by 10 feet until the start of your next turn. If the creature is hit more than once by weapons that have this property, the Speed reduction doesn't exceed 10 feet."
"Light Hammer","PHB'24","215","none","weapon, simple weapon, melee weapon","","1d4 Bludgeoning","Light, Thrown (20/60 ft.)","Mastery: Nick","2 lb.","2 gp","Light. When you take the Attack action on your turn and attack with a Light weapon, you can make one extra attack as a Bonus Action later on the same turn. That extra attack must be made with a different Light weapon, and you don't add your ability modifier to the extra attack's damage unless that modifier is negative. For example, you can attack with a Shortsword in one hand and a Dagger in the other using the Attack action and a Bonus Action, but you don't add your Strength or Dexterity modifier to the damage roll of the Bonus Action unless that modifier is negative. Thrown. If a weapon has the Thrown property, you can throw the weapon to make a ranged attack, and you can draw that weapon as part of the attack. If the weapon is a Melee weapon, use the same ability modifier for the attack and damage rolls that you use for a melee attack with that weapon. Mastery: Nick. When you make the extra attack of the Light property, you can make it as part of the Attack action instead of as a Bonus Action. You can make this extra attack only once per turn."
"Light Repeating Crossbow","OotA","224","unknown","weapon, simple weapon, ranged weapon","","1d8 Piercing","ammunition (40/160 ft.), two‑handed","","5 lb.","","This crossbow is fitted with a cartridge that can hold up to six crossbow bolts. It automatically reloads after firing until the cartridge runs out of ammunition. Reloading the cartridge takes an action. Range. A weapon that can be used to make a ranged attack has a range shown in parentheses after the ammunition or thrown property. The range lists two numbers. The first is the weapon's normal range in feet, and the second indicates the weapon's maximum range. When attacking a target beyond normal range, you have disadvantage on the attack roll. You can't attack a target beyond the weapon's long range. Ammunition. You can use a weapon that has the ammunition property to make a ranged attack only if you have ammunition to fire from the weapon. Each time you attack with the weapon, you expend one piece of ammunition. Drawing the ammunition from a quiver, case, or other container is part of the attack. Loading a one-handed weapon requires a free hand. At the end of the battle, you can recover half your expended ammunition by taking a minute to search the battlefield.If you use a weapon that has the ammunition property to make a melee attack, you treat the weapon as an improvised weapon. A sling must be loaded to deal any damage when used in this way. Two-Handed. This weapon requires two hands to use. This property is relevant only when you attack with the weapon, not when you simply hold it."
"Linen (1 sq. yd.)","DMG'24","213","none","trade good","","","","","","5 gp","Merchants commonly exchange trade goods without using currency."
"Living Ship","AAG","36","none","vehicle (space)","","Speed: 4½ mphCarrying Capacity: 10 tons cargoCrew 5, AC 15, HP 250, Damage Threshold 15","","","","25,000 gp","Druids, rangers, and clerics devoted to gods of nature are often found aboard living ships, as are Wildspace explorers who don't want to have to worry about their ship's air envelope becoming fouled during a long voyage.This ship's main distinctive feature is the fully grown treant on the aft deck. The treant has a speed of 0 because its roots are woven into the deck; it and the ship are inseparable. If the ship is reduced to 0 hit points, the treant dies of shock. The ship can function if its treant dies, but the treant can never be replaced with another.When the treant finishes a long rest, it repairs the ship's hull, enabling the ship to regain 4d12 hit points, and refreshes the ship's air envelope (turning deadly air into foul air, or foul air into fresh air).A living ship can float on water and sail across it, but it can't land safely on the ground (its keel would cause it to roll on its side). Its standard weaponry is an aft-mounted ballista."
"Lock","PHB'24","226","none","adventuring gear","","","","","1 lb.","10 gp","A Lock comes with a key. Without the key, a creature can use Thieves' Tools to pick this Lock with a successful DC 15 Dexterity (Sleight of Hand) check."
"Lolth's Sting","DMG'24","91","none","adventuring gear, poison (injury)","","","","","","200 gp","A creature subjected to Lolth's Sting must succeed on a DC 13 Constitution saving throw or have the Poisoned condition for 1 hour. If the creature fails the save by 5 or more, the creature also has the Unconscious condition while Poisoned in this way. The creature wakes up if it takes damage or if another creature takes an action to shake it awake."
"Longbow","PHB'24","215","none","weapon, martial weapon, ranged weapon","","1d8 Piercing","Ammunition (Range 150/600 ft.; Arrow), Heavy, Two‑Handed","Mastery: Slow","2 lb.","50 gp","Range. A Range weapon has a range in parentheses after the Ammunition or Thrown property. The range lists two numbers. The first is the weapon's normal range in feet, and the second is the weapon's long range. When attacking a target beyond normal range, you have Disadvantage on the attack roll. You can't attack a target beyond the long range. Ammunition. You can use a weapon that has the Ammunition property to make a ranged attack only if you have ammunition to fire from it. The type of ammunition required is specified with the weapon's range. Each attack expends one piece of ammunition. Drawing the ammunition is part of the attack (you need a free hand to load a one-handed weapon). After a fight, you can spend 1 minute to recover half the ammunition (round down) you used in the fight; the rest is lost. Heavy. You have Disadvantage on attack rolls with a Heavy weapon if it's a Melee weapon and your Strength score isn't at least 13 or if it's a Ranged weapon and your Dexterity score isn't at least 13. Two-Handed. A Two-Handed weapon requires two hands when you attack with it. Mastery: Slow. If you hit a creature with this weapon and deal damage to it, you can reduce its Speed by 10 feet until the start of your next turn. If the creature is hit more than once by weapons that have this property, the Speed reduction doesn't exceed 10 feet."
"Longhorn","SCAG","124","none","instrument","","","","","","","A Faerûnian flute of sophisticated make, found only in areas with skilled artisans, as in great cities or elven enclaves.If you have proficiency with a given musical instrument, you can add your proficiency bonus to any ability checks you make to play music with the instrument. A bard can use a musical instrument as a spellcasting focus. Each type of musical instrument requires a separate proficiency.See the Tool Proficiencies entry for more information.Proficiency with a musical instrument indicates you are familiar with the techniques used to play it. You also have knowledge of some songs commonly performed with that instrument. History. Your expertise aids you in recalling lore related to your instrument. Performance. Your ability to put on a good show is improved when you incorporate an instrument into your act. Compose a Tune. As part of a long rest, you can compose a new tune and lyrics for your instrument. You might use this ability to impress a noble or spread scandalous rumors with a catchy tune.Musical InstrumentActivityDCIdentify a tune10Improvise a tune20"
"Longship","PHB'24","230","none","vehicle (water)","","Speed: 3 mphCarrying Capacity: 10 tons cargo, 150 passengersCrew 40, AC 15, HP 300, Damage Threshold 15","","","","10,000 gp","Speed. A ship sailing against a strong wind moves at half speed. In a dead calm (no wind), waterborne ships can't move under sail and must be rowed. Keelboats and Rowboats are used on lakes and rivers. If going downstream, add the speed of the current (typically 3 miles per hour) to the speed of the vehicle. These vehicles can't be rowed against any significant current, but they can be pulled upstream by draft animals on the shores. A Rowboat can be carried and weighs 100 pounds. Crew. A ship larger than a Keelboat or Rowboat needs a crew of skilled hirelings (see ""Services"") to function. The minimum number of skilled hirelings needed to crew a ship depends on the type of ship. Passengers. The number of Small and Medium passengers the ship can accommodate using hammocks. A ship outfitted with private accommodations can carry one-fifth as many passengers. A passenger usually pays 5 SP per day for a hammock, but prices can vary from ship to ship. A small private cabin usually costs 2 GP per day. Damage Threshold. See the rules glossary. Ship Repair. Repairs to a damaged ship can be made while the vessel is berthed. Repairing 1 Hit Point of damage requires 1 day and costs 20 GP for materials and labor. If the repairs are made in a location where supplies and skilled labor are abundant, such as a city shipyard, the repair time and cost are halved."
"Longsword","PHB'24","215","none","weapon, martial weapon, melee weapon","","1d8 Slashing","Versatile (1d10)","Mastery: Sap","3 lb.","15 gp","Versatile. A Versatile weapon can be used with one or two hands. A damage value in parentheses appears with the property. The weapon deals that damage when used with two hands to make a melee attack. Mastery: Sap. If you hit a creature with this weapon, that creature has Disadvantage on its next attack roll before the start of your next turn."
"Lorehold Trinket","SCC","31","none","adventuring gear","","","","","","","When you make your character, you may roll once on the Lorehold Trinkets table, instead of on the Trinkets table in the Player's Handbook, for your starting trinket.Lorehold Trinketsd6Trinket1A map made of concentric circles that can be rotated around the page2A puzzle box bedecked with amber3A dented brass compass with a red needle4The head of a broken statue that houses the consciousness of a snarky sage5A sheet of parchment embossed with tactile lettering, glowing red6A broken dagger with a wavy blade and a serpentine hilt"
"Lute","PHB'24","221","none","instrument","","","","","2 lb.","35 gp","Ability: CharismaUtilize: Play a known tune (DC 10), or improvise a song (DC 15)If you have proficiency with a tool, add your Proficiency Bonus to any ability check you make that uses the tool. If you have proficiency in a skill that's used with that check, you have Advantage on the check too."
