"Name","Source","Page","Rarity","Type","Attunement","Damage","Properties","Mastery","Weight","Value","Text"
"Silverquill Trinket","SCC","35","none","adventuring gear","","","","","","","When you make your character, you may roll once on the Silverquill Trinkets table, instead of on the Trinkets table in the Player's Handbook, for your starting trinket.Silverquill Trinketsd6Trinket1A black leather notebook filled with half-finished poems2A set of flashcards detailing different colloquialisms and their meanings3A canteen that makes any liquid drunk from it taste sweet4A forged permission slip granting access to the special archives of Strixhaven's libraries5A stylish silver pin that references a famous series of novels about warlocks6A stack of small pieces of parchment, each enchanted to stick to whatever surface it's pressed against and peel off easily"
"Sinda berries (10)","ToA","205","unknown","adventuring gear","","","","","","5 gp","These berries are dark brown and bitter. A full-grown sinda berry bush has 4d6 berries growing on it. A bush plucked of all its berries grows new berries in 1d4 months. Picked berries lose their freshness and efficacy after 24 hours.Fresh sinda berries can be eaten raw or crushed and added to a drink to dull the bitterness. A creature that consumes at least ten fresh sinda berries gains advantage on saving throws against disease and poison for the next 24 hours."
"Skyship","EGW","72","none","vehicle (air)","","Speed: 10 mphCarrying Capacity: 10 tons cargo, 30 passengersPersonal Travel Cost: 2 gp per mile per passengerShipping Cost: 1 gp per 100 pounds per mileCrew 6-10","","","","100,000 gp","Crew. A ship needs a crew of skilled hirelings to function. As per the Player's Handbook, one skilled hireling costs at least 2 gp per day. The minimum number of skilled hirelings needed to crew a ship depends on the type of vessel.You can track the loyalty of individual crew members or the crew as a whole using the optional loyalty rules in chapter 4 of the Dungeon Master's Guide. If at least half the crew becomes disloyal during a voyage, the crew turns hostile and stages a mutiny. If the ship is berthed, disloyal crew members leave the ship and never return. Passengers. This indicates the number of Small and Medium passengers the ship can accommodate.Accommodations consist of shared hammocks in tight quarters. A ship outfitted with private accommodations can carry one-fifth as many passengers.A passenger is usually expected to pay 5 sp per day for a hammock, but prices can vary from ship to ship. A small private cabin usually costs 2 gp per day. Cargo. The maximum tonnage the ship can carry. Damage Threshold. If a ship has a Damage Threshold, it has immunity to all damage unless it takes an amount of damage equal to or greater than its damage threshold, in which case it takes damage as normal. Any damage that fails to meet or exceed the damage threshold is considered superficial and doesn't reduce the ship's hit points. Ship Repair. Repairs to a damaged ship can be made while the vessel is berthed. Repairing 1 hit point of damage requires 1 day and costs 20 gp for materials and labor."
"Skyship","TDCSR","137","none","vehicle (air)","","Speed: 10 mphCarrying Capacity: 10 tons cargo, 30 passengersPersonal Travel Cost: 2 gp per mile per passengerShipping Cost: 1 gp per 100 pounds per mileCrew 6-10","","","","100,000 gp","Purchasing a skyship costs 100,000 gp, and requires a personal connection with the Alsfarin Union in Ank'Harel. A skyship travels at a top speed of 10 miles per hour, can carry total cargo of 10 tons, and requires a crew of six to ten humanoids to operate at peak performance. Most skyships have maximum accommodations for up to 30 passengers. Most skyships only travel between existing skyports (see ""Emon Skyport,""), and charge a fee of 2 gp per mile for a passenger ticket. Chartering a skyship to a destination off the standard sky routes costs 15 gp per mile, if the captain is available and willing to undertake the journey. Shipping cargo costs 1 gp per mile per 100 pounds of cargo along normal sky routes, and twice that to other destinations. Crew. A ship needs a crew of skilled hirelings to function. As per the Player's Handbook, one skilled hireling costs at least 2 gp per day. The minimum number of skilled hirelings needed to crew a ship depends on the type of vessel.You can track the loyalty of individual crew members or the crew as a whole using the optional loyalty rules in chapter 4 of the Dungeon Master's Guide. If at least half the crew becomes disloyal during a voyage, the crew turns hostile and stages a mutiny. If the ship is berthed, disloyal crew members leave the ship and never return. Passengers. This indicates the number of Small and Medium passengers the ship can accommodate.Accommodations consist of shared hammocks in tight quarters. A ship outfitted with private accommodations can carry one-fifth as many passengers.A passenger is usually expected to pay 5 sp per day for a hammock, but prices can vary from ship to ship. A small private cabin usually costs 2 gp per day. Cargo. The maximum tonnage the ship can carry. Damage Threshold. If a ship has a Damage Threshold, it has immunity to all damage unless it takes an amount of damage equal to or greater than its damage threshold, in which case it takes damage as normal. Any damage that fails to meet or exceed the damage threshold is considered superficial and doesn't reduce the ship's hit points. Ship Repair. Repairs to a damaged ship can be made while the vessel is berthed. Repairing 1 hit point of damage requires 1 day and costs 20 gp for materials and labor."
"Sled","PHB'24","230","none","vehicle (land)","","","","","300 lb.","20 gp",""
"Sled Dog","IDRotF","20","none","mount","","","","","","50 gp","A sled dog (use the wolf stat block in appendix A of the Monster Manual) costs 50 gp and can pull 360 pounds.Sled dogs must take a short rest after pulling a sled for 1 hour; otherwise, they gain one level of exhaustion."
"Sledgehammer","PHB'14","150","none","adventuring gear","","","","","10 lb.","2 gp",""
"Sleep Grenade","QftIS","192","none","explosive","","","","","","","As an action, a character can throw a grenade at a point up to 60 feet away. With a grenade launcher, the character can propel the grenade up to 120 feet away.This grenade releases a cloud of soporific mist that fills a 20-foot-radius sphere, then dissipates. Each creature in that area must succeed on a DC 15 Constitution saving throw or have the unconscious condition for 1 hour. The condition ends on a creature early if the creature takes damage or if another creature uses an action to shake it awake."
"Sling","PHB'24","215","none","weapon, simple weapon, ranged weapon","","1d4 Bludgeoning","Ammunition (Range 30/120 ft.; Sling Bullet)","Mastery: Slow","","1 sp","Range. A Range weapon has a range in parentheses after the Ammunition or Thrown property. The range lists two numbers. The first is the weapon's normal range in feet, and the second is the weapon's long range. When attacking a target beyond normal range, you have Disadvantage on the attack roll. You can't attack a target beyond the long range. Ammunition. You can use a weapon that has the Ammunition property to make a ranged attack only if you have ammunition to fire from it. The type of ammunition required is specified with the weapon's range. Each attack expends one piece of ammunition. Drawing the ammunition is part of the attack (you need a free hand to load a one-handed weapon). After a fight, you can spend 1 minute to recover half the ammunition (round down) you used in the fight; the rest is lost. Mastery: Slow. If you hit a creature with this weapon and deal damage to it, you can reduce its Speed by 10 feet until the start of your next turn. If the creature is hit more than once by weapons that have this property, the Speed reduction doesn't exceed 10 feet."
"Sling Bullet","PHB'24","222","none","ammunition","","","","","1.2 oz.","0.2 cp","Sling bullets are used with a weapon that has the ammunition property to make a ranged attack. Each time you attack with the weapon, you expend one piece of ammunition. Drawing the ammunition from a quiver, case, or other container is part of the attack (you need a free hand to load a one-handed weapon). At the end of the battle, you can recover half your expended ammunition by taking a minute to search the battlefield.Sling Bullets are typically stored in a Pouch (bought separately)."
"Sling Bullets (20)","PHB'24","222","none","ammunition","","","","","1½ lb.","4 cp","Sling bullets are used with a weapon that has the ammunition property to make a ranged attack. Each time you attack with the weapon, you expend one piece of ammunition. Drawing the ammunition from a quiver, case, or other container is part of the attack (you need a free hand to load a one-handed weapon). At the end of the battle, you can recover half your expended ammunition by taking a minute to search the battlefield.Sling Bullets are typically stored in a Pouch (bought separately)."
"Smith's Tools","PHB'24","221","none","artisan's tools","","","","","8 lb.","20 gp","Ability: StrengthUtilize: Pry open a door or container (DC 20)Craft: Any Melee weapon (except Club, Greatclub, Quarterstaff, and Whip), Medium armor (except Hide), Heavy armor, Ball Bearings, Bucket, Caltrops, Chain, Crowbar, Firearm Bullets, Grappling Hook, Iron Pot, Iron Spikes, Sling BulletsArtisan's Tools are each focused on crafting items and pursuing a trade. Each type of Artisan's Tools tools requires a separate proficiency.If you have proficiency with a tool, add your Proficiency Bonus to any ability check you make that uses the tool. If you have proficiency in a skill that's used with that check, you have Advantage on the check too."
"Smoke Grenade","DMG'24","73","none","explosive","","","","","2 lb.","50 gp","As an action, you can either throw a grenade at a point up to 60 feet away or use a Grenade Launcher to propel the grenade to a point up to 1,000 feet away. The grenade explodes at that point, creating a particular effect in a 20-foot-radius Sphere.The area of the Sphere is Heavily Obscured by smoke for 1 minute. A strong wind (such as the Gust of Wind spell) disperses the smoke."
"Snowshoes","IDRotF","20","none","adventuring gear","","","","","4 lb.","2 gp","Snowshoes reduce the likelihood of their wearer getting stuck in the deep snow."
"Soap","PHB'14","150","none","adventuring gear","","","","","","2 cp",""
"Songhorn","SCAG","124","none","instrument","","","","","","","A recorder, a simple type of flute, usually carved from wood.If you have proficiency with a given musical instrument, you can add your proficiency bonus to any ability checks you make to play music with the instrument. A bard can use a musical instrument as a spellcasting focus. Each type of musical instrument requires a separate proficiency.See the Tool Proficiencies entry for more information.Proficiency with a musical instrument indicates you are familiar with the techniques used to play it. You also have knowledge of some songs commonly performed with that instrument. History. Your expertise aids you in recalling lore related to your instrument. Performance. Your ability to put on a good show is improved when you incorporate an instrument into your act. Compose a Tune. As part of a long rest, you can compose a new tune and lyrics for your instrument. You might use this ability to impress a noble or spread scandalous rumors with a catchy tune.Musical InstrumentActivityDCIdentify a tune10Improvise a tune20"
"Soothsalts","EGW","152","none","adventuring gear","","","","","","150 gp","Soothsalts are derived from a naturally occurring crystalline substance discovered throughout the wilds of the Miskath Strand. The crimson crystals have been mined from cavernous veins like those in the mouth of the Miskath Pit and found within smaller geode formations near sites ravaged by the Calamity. Soothsalts are consumed orally in lozenge-sized doses, and frequent users can be identified by the telltale crimson stain around their mouths. A creature subjected to a dose of soothsalts gains advantage on all Intelligence checks for 1d4 hours.For each dose of soothsalts consumed, the creature must succeed on a DC 15 Constitution saving throw or gain one level of exhaustion—an effect which is cumulative with multiple doses."
"Space Galleon","AAG","46","none","vehicle (space)","","Speed: 4 mphCarrying Capacity: 20 tons cargoCrew 20, AC 15, HP 400, Damage Threshold 15","","","","30,000 gp","The space galleon is a mainstay among the host of vessels that ply Wildspace and the Astral Sea. Space galleons can easily pass for ordinary seafaring galleons. Because they can land on water and move across it like their namesakes, they can sail into ports on terrestrial worlds without attracting undue attention. Like an ordinary galleon, a space galleon isn't built to land on the ground (its keel would cause it to roll on its side). The ship's standard weaponry includes two forward-mounted ballistae and an aft-mounted mangonel."
"Spear","PHB'24","215","none","weapon, simple weapon, melee weapon","","1d6 Piercing","Thrown (20/60 ft.), Versatile (1d8)","Mastery: Sap","3 lb.","1 gp","Thrown. If a weapon has the Thrown property, you can throw the weapon to make a ranged attack, and you can draw that weapon as part of the attack. If the weapon is a Melee weapon, use the same ability modifier for the attack and damage rolls that you use for a melee attack with that weapon. Versatile. A Versatile weapon can be used with one or two hands. A damage value in parentheses appears with the property. The weapon deals that damage when used with two hands to make a melee attack. Mastery: Sap. If you hit a creature with this weapon, that creature has Disadvantage on its next attack roll before the start of your next turn."
"Spellbook","PHB'14","153","none","adventuring gear","","","","","3 lb.","50 gp","Essential for wizards, a spellbook is a leather-bound tome with 100 blank vellum pages suitable for recording spells."
"Spiked Armor","SCAG","121","unknown","medium armor","","AC 14 + Dex (max 2)","","","45 lb.","75 gp","Spiked armor is a rare type of medium armor made by dwarves. It consists of a leather coat and leggings covered with spikes that are usually made of metal.The wearer has Disadvantage on Dexterity (Stealth) checks."
"Spinosaurus","ToB1'23","103","none","mount","","","","","","2,000 gp","Before it can be ridden in combat, a spinosaurus dinosaur must practice bearing the weight of its trainer and passengers. They rarely master more than a handful of tricks, but they are extremely comfortable in the water and can be trained to be are aware that some of their riders may not breathe water.An adult spinosaurus can carry up to six tons as cargo. Riding a spinosaurus requires an exotic saddle, riding platform, or howdah."
"Splint Armor","PHB'24","219","none","heavy armor","","AC 17","","","60 lb.","200 gp","The wearer has Disadvantage on Dexterity (Stealth) checks.If the wearer has a Strength score lower than 15, their speed is reduced by 10 feet."
"Sprig of Mistletoe","PHB'24","225","none","spellcasting focus","","","","","","1 gp","A Druidic Focus takes a specific form and is carved, tied with ribbon, or painted to channel primal magic. A Druid or Ranger can use such an object as a Spellcasting Focus."
"Spyglass","PHB'24","229","none","adventuring gear","","","","","1 lb.","1,000 gp","Objects viewed through a Spyglass are magnified to twice their size."
"Squid Ship","AAG","48","none","vehicle (space)","","Speed: 3½ mphCarrying Capacity: 20 tons cargoCrew 13, AC 15, HP 300, Damage Threshold 15","","","","25,000 gp","Among the oldest types of spelljamming vessels, squid ships are popular with privateers and are often used as patrol ships. Standard weapons on a squid ship include a forward-mounted mangonel, two aft-mounted ballistae, and a reinforced bow for ramming. The tentacles that extend from the bow account for nearly half the ship's keel length.Squid ships can float and sail on water, and they can land on the ground."
"Stabling (per day)","PHB'24","230","none","tack and harness","","","","","","5 cp",""
"Staff","PHB'24","224","none","staff, weapon, spellcasting focus, simple weapon, melee weapon","","1d6 Bludgeoning","versatile (1d8)","","4 lb.","5 gp","Versatile. This weapon can be used with one or two hands. A damage value in parentheses appears with the property—the damage when the weapon is used with two hands to make a melee attack.An Arcane Focus takes a specific form and is bejeweled or carved to channel arcane magic. A Sorcerer, Warlock, or Wizard can use such an item as a Spellcasting Focus."
"Star Moth","AAG","50","none","vehicle (space)","","Speed: 5½ mphCarrying Capacity: 30 tons cargoCrew 13, AC 13, HP 400, Damage Threshold 15","","","","40,000 gp","Star moths are ships constructed and flown by astral elves, who don't like it when these ships end up in the hands of others.A star moth's hull is fashioned from a grown and sculpted organic substance, and its enormous, decorative wings are made of shimmering crystal. The vessel is built for space travel, but its design does enable it to float on water or land safely on the ground. Standard weaponry includes two ballistae nestled in the star moth's eye holes and a mangonel mounted above the bridge."
"Stink Bomb","TDCSR","100","none","explosive","","","range 30 ft.","","","25 gp","This smelly explosive can be primed and thrown up to 30 feet as an action. It explodes at the start of your next turn. Creatures within 20 feet of it must make a DC 12 Constitution saving throw or be poisoned for 1 minute. A creature can repeat this save at the end of each of its turns, ending the effect on itself on a success."
"String","PHB'24","229","none","adventuring gear","","","","","","1 sp","String is 10 feet long. You can tie a knot in it as a Utilize action."
"Studded Leather Armor","PHB'24","219","none","light armor","","AC 12 + Dex","","","13 lb.","45 gp",""
"Survival Mantle","VGM","81","unknown","medium armor","","AC 15 + Dex (max 2)","","","40 lb.","","This carapace-like augmentation encases portions of the wearer's shoulders, neck, and chest. A survival mantle is equivalent to a suit of nonmagical half plate armor and takes just as long to don or doff. It can't be worn with other kinds of armor.A creature wearing a survival mantle can breathe normally in any environment (including a vacuum) and has advantage on saving throws against harmful gases (such as those created by a cloudkill spell, a stinking cloud spell, inhaled poisons, and the breath weapons of some dragons).The wearer has Disadvantage on Dexterity (Stealth) checks."
"Tangler Grenade","WDMM","244","none","other","","","","","","","A tangler grenade is an alchemical, nonmagical item with an ovoid resin shell that shatters on impact. An as action, a creature can throw a tangler grenade at a point up to 60 feet away. Each creature within 10 feet of a shattered tangler grenade must succeed on a DC 15 Dexterity saving throw or be restrained by sticky white webs. As an action, a creature can try to free itself or another creature within its reach from the webs, doing so with a successful DC 20 Strength (Athletics) check. A gallon of alcohol dissolves the webs produced by a single tangler grenade. Otherwise, the webs dissolve on their own after 1 hour, freeing any creatures restrained by them."
"Tankard","PHB'14","153","none","adventuring gear","","","","","1 lb.","2 cp","A tankard holds 1 pint of liquid."
"Tantan","SCAG","124","none","instrument","","","","","","","A tambourine, a popular instrument with halflings and humans south of the Dalelands.If you have proficiency with a given musical instrument, you can add your proficiency bonus to any ability checks you make to play music with the instrument. A bard can use a musical instrument as a spellcasting focus. Each type of musical instrument requires a separate proficiency.See the Tool Proficiencies entry for more information.Proficiency with a musical instrument indicates you are familiar with the techniques used to play it. You also have knowledge of some songs commonly performed with that instrument. History. Your expertise aids you in recalling lore related to your instrument. Performance. Your ability to put on a good show is improved when you incorporate an instrument into your act. Compose a Tune. As part of a long rest, you can compose a new tune and lyrics for your instrument. You might use this ability to impress a noble or spread scandalous rumors with a catchy tune.Musical InstrumentActivityDCIdentify a tune10Improvise a tune20"
"Tej","ToA","32","none","food and drink","","","","","5 lb.","","Tej is an amber-colored, fermented drink made from honey. It's more common and popular in Chult than beer or ale. A mug of tej costs 4 cp in Port Nyanzaru or 6 cp in Fort Beluarian. A 1-gallon cask costs 2 sp in the city or 3 sp at the fort."
"Tent","PHB'24","229","none","adventuring gear","","","","","20 lb.","2 gp","A Tent sleeps up to two Small or Medium creatures."
"The Incantations of Iriolarthas","IDRotF","317","unknown","adventuring gear","","","","","3 lb.","","The Incantations of Iriolarthas is a weighty spellbook. Its black leather covers have dead, toothy worms glued to them, sheathed in glossy varnish. Set into this morbid display on the front cover is a gold rune that resembles a stylized eye with a pupil shaped like a candle flame—the sigil of Iriolarthas, a Netherese lich.The book contains sixty pages of brittle yellow vellum. Written on these pages are the following wizard spells:1st level: alarm, detect magic, identify, magic missile, shield, Tasha's hideous laughter, thunderwave2nd level: arcane lock, continual flame, invisibility, knock, levitate, Melf's acid arrow, mirror image3rd level: animate dead, bestow curse, clairvoyance, counterspell, dispel magic, fireball, glyph of warding4th level: arcane eye, banishment, blight, dimension door, Evard's black tentacles, phantasmal killer5th level: Bigby's hand, cloudkill, dominate person, planar binding, scrying, telekinesis6th level: create undead, disintegrate, globe of invulnerability, move earth, Otto's irresistible dance7th level: create magen, finger of death, prismatic spray, teleport8th level: demiplane, dominate monster, mind blank, power word stun9th level: blade of disaster, power word kill"
"Theki Root","EGW","70","none","adventuring gear","","","","","","3 gp","This thick marsh root tastes bitter but is thought to aid digestive health. When you use an action to consume a dose, you gain advantage on saving throws against the effects of poisonous or toxic substances for 8 hours."
"Thelarr","SCAG","124","none","instrument","","","","","","","Also known as a whistlecane, a simple and easy-to-make wind instrument cut from a reed. They are so simple, in fact, that skilled bards frequently make and give them away to children—to the parents' delight or regret.If you have proficiency with a given musical instrument, you can add your proficiency bonus to any ability checks you make to play music with the instrument. A bard can use a musical instrument as a spellcasting focus. Each type of musical instrument requires a separate proficiency.See the Tool Proficiencies entry for more information.Proficiency with a musical instrument indicates you are familiar with the techniques used to play it. You also have knowledge of some songs commonly performed with that instrument. History. Your expertise aids you in recalling lore related to your instrument. Performance. Your ability to put on a good show is improved when you incorporate an instrument into your act. Compose a Tune. As part of a long rest, you can compose a new tune and lyrics for your instrument. You might use this ability to impress a noble or spread scandalous rumors with a catchy tune.Musical InstrumentActivityDCIdentify a tune10Improvise a tune20"
"Thessaltoxin","IMR","93","none","poison (ingested or injury)","","","","","","","This poison was first created using blood harvested from the artificer Thessalar. A creature subjected to the poison must succeed on a DC 15 Constitution saving throw or take on a new form as if affected by the polymorph spell. The creature's new form is a random beast or a creature it has seen within the last 24 hours (as chosen by the DM). This transformation lasts until the end of the target's next long rest. This effect is not subject to dispel magic or remove curse, but a greater restoration spell restores the creature to its original form."
"Thieves' Tools","PHB'24","221","none","tool","","","","","1 lb.","25 gp","Ability: DexterityUtilize: Pick a lock (DC 15), or disarm a trap (DC 15)If you have proficiency with a tool, add your Proficiency Bonus to any ability check you make that uses the tool. If you have proficiency in a skill that's used with that check, you have Advantage on the check too."
"Three-Dragon Ante Set","PHB'24","221","none","gaming set","","","","","","1 gp","Ability: WisdomUtilize: Discern whether someone is cheating (DC 10), or win the game (DC 20)If you have proficiency with a tool, add your Proficiency Bonus to any ability check you make that uses the tool. If you have proficiency in a skill that's used with that check, you have Advantage on the check too."
"Tinderbox","PHB'24","229","none","adventuring gear","","","","","1 lb.","5 sp","A Tinderbox is a small container holding flint, fire steel, and tinder (usually dry cloth soaked in light oil) used to kindle a fire. Using it to light a Candle, Lamp, Lantern, or Torch—or anything else with exposed fuel—takes a Bonus Action. Lighting any other fire takes 1 minute."
