"Name","Source","Page","Rarity","Type","Attunement","Damage","Properties","Mastery","Weight","Value","Text"
"Dreamlily","ERLW","244","none","other","","","","","","","A psychoactive liquid that smells and tastes like your favorite beverage, essence of dreamlily is a Sarlonan opiate. First imported to help manage pain during the Last War, it's now the most commonly abused substance in Sharn. Though dreamlily isn't illegal if used for medicinal purposes, it's heavily taxed, and thus most dreamlily is smuggled in and sold on the black market. Dreamlily dens can be found across the lower wards. Consuming dreamlily causes disorienting euphoria and brings about remarkable resistance to pain. A creature under the effects of dreamlily is poisoned for 1 hour. While poisoned in this way, the creature is immune to fear, and the first time it drops to 0 hit points without being killed outright, it drops to 1 hit point instead. A dose of dreamlily costs around 1 gp, or up to ten times that if purchased through legal channels. There are many varieties of the drug, however, and the duration or the price might vary accordingly."
"Druidic Focus","PHB'24","225","none","spellcasting focus","","","","","","","A Druidic Focus takes a specific form and is carved, tied with ribbon, or painted to channel primal magic. A Druid or Ranger can use such an object as a Spellcasting Focus.Multiple variations of this item exist, as listed below:Sprig of mistletoeWooden staffYew wand"
"Drum","PHB'24","221","none","instrument","","","","","3 lb.","6 gp","Ability: CharismaUtilize: Play a known tune (DC 10), or improvise a song (DC 15)If you have proficiency with a tool, add your Proficiency Bonus to any ability check you make that uses the tool. If you have proficiency in a skill that's used with that check, you have Advantage on the check too."
"Dulcimer","PHB'24","221","none","instrument","","","","","10 lb.","25 gp","Ability: CharismaUtilize: Play a known tune (DC 10), or improvise a song (DC 15)If you have proficiency with a tool, add your Proficiency Bonus to any ability check you make that uses the tool. If you have proficiency in a skill that's used with that check, you have Advantage on the check too."
"Dungeoneer's Pack","PHB'24","225","none","adventuring gear","","","","","55 lb.","12 gp","A Dungeoneer's Pack contains the following items: Backpack, Caltrops, Crowbar, 2 flasks of Oil, 10 days of Rations, Rope, Tinderbox, 10 Torches, and Waterskin."
"Dust of the Mummy","IMR","93","none","poison (inhaled)","","","","","","","This poison is created during a mummy's embalming process, distilled from the dead creature's removed organs. A creature subjected to this poison must succeed on a DC 12 Constitution saving throw or be cursed with mummy rot. The cursed creature can't regain hit points, and its hit point maximum decreases by 10 (3d6) for every 24 hours that elapse. If the curse reduces the creature's hit point maximum to 0, the creature dies, and its body turns to dust. The curse lasts until removed by the remove curse spell or similar magic."
"Dynamite","TDCSR","100","none","explosive","","6d6 Fire","range 30 ft.","","","100 gp","This bundle of explosives can be lit and thrown up to 30 feet as an action. It explodes at the start of your next turn. Creatures and objects within 20 feet of it must make a DC 12 Dexterity saving throw, taking 6d6 fire damage on a failed save, or half as much damage on a successful one."
"Elephant","PHB'24","229","none","mount","","Speed: 40, Carrying Capacity: 1320 lb.","","","","200 gp",""
"Elven Trinket","MTF","64","none","adventuring gear","","","","","","","d8Trinket1A small notebook that causes anything written in it to disappear after 1 hour2A crystal lens made of ivory and gold that causes anything observed through it to appear to be surrounded by motes of multicolored light3A small golden pyramid inscribed with elven symbols and about the size of a walnut4A cloak pin made from enamel in the shape of a butterfly; when you take the pin off, it turns into a real butterfly, and returns when you are ready to put your cloak back on again5A golden compass that points toward the nearest portal to the Feywild within 10 miles6A small silver spinning top that, when spun, endlessly spins until interrupted7A small songbird made of enamel, gold wire, and precious stone; uttering the songbird's name in Elvish causes the trinket to emit that bird's birdsong8A small enamel flower that, when put in one's hair, animates, tying back the wearer's hair with a living vine with flowers; plucking a single flower from this vine returns it to its inanimate form"
"Emblem","PHB'24","226","none","spellcasting focus","","","","","","5 gp","For an Emblem to be an effective Holy Symbol, it must be borne on fabric (such as a tabard or banner) or a Shield.A Holy Symbol takes a specific form and is bejeweled or painted to channel divine magic. A Cleric or Paladin can use a Holy Symbol as a Spellcasting Focus."
"Enchanted Three-Dragon Ante Set","LLK","15","none","gaming set","","","","","","","One card in this deck is enchanted to appear as whatever specific card its owner commands. This magic works only 25 percent of the time, but the deck is worth 500 gp to any serious gambler who doesn't mind the risk—or who isn't told about it.If you are proficient with a gaming set, you can add your proficiency bonus to ability checks you make to play a game with that set. Each type of gaming set requires a separate proficiency.See the Tool Proficiencies entry for more information.Proficiency with a gaming set applies to one type of game, such as Three-Dragon Ante or games of chance that use dice. Components. A gaming set has all the pieces needed to play a specific game or type of game, such as a complete deck of cards or a board and tokens. History. Your mastery of a game includes knowledge of its history, as well as of important events it was connected to or prominent historical figures involved with it. Insight. Playing games with someone is a good way to gain understanding of their personality, granting you a better ability to discern their lies from their truths and read their mood. Sleight of Hand. Sleight of Hand is a useful skill for cheating at a game, as it allows you to swap pieces, palm cards, or alter a die roll. Alternatively, engrossing a target in a game by manipulating the components with dexterous movements is a great distraction for a pickpocketing attempt.Gaming SetActivityDCCatch a player cheating15Gain insight into an opponent's personality15"
"Entertainer's Pack","PHB'24","225","none","adventuring gear","","","","","58½ lb.","40 gp","An Entertainer's Pack contains the following items: Backpack, Bedroll, Bell, Bullseye Lantern, 3 Costumes, Mirror, 8 flasks of Oil, 9 days of Rations, Tinderbox, and Waterskin."
"Essence of Ether","DMG'24","90","none","adventuring gear, poison (inhaled)","","","","","","300 gp","A creature subjected to Essence of Ether must succeed on a DC 15 Constitution saving throw or have the Poisoned condition for 8 hours. The creature also has the Unconscious condition while Poisoned in this way. The creature wakes up if it takes damage or if another creature takes an action to shake it awake."
"Exotic Saddle","PHB'24","230","none","tack and harness","","","","","40 lb.","60 gp","A saddle comes with a bit, a bridle, reins, and any other equipment needed to use the saddle. An Exotic Saddle is required for riding an aquatic or a flying mount."
"Explorer's Pack","PHB'24","225","none","adventuring gear","","","","","55 lb.","10 gp","An Explorer's Pack contains the following items: Backpack, Bedroll, 2 flasks of Oil, 10 days of Rations, Rope, Tinderbox, 10 Torches, and Waterskin."
"Explosive Seed","EGW","225","none","adventuring gear","","","","","","","This acorn-sized sphere of brass contains a small amount of blasting powder and a clockwork trigger. An explosive seed can be thrown up to 30 feet as an action, detonating on impact. Each creature within 5 feet of the exploding seed must make a DC 10 Dexterity saving throw, taking 1d8 bludgeoning damage on a failed save, or half as much damage on a successful one."
"Eyescratch","WDH","211","none","adventuring gear, poison (contact)","","","","","","","A creature that comes into contact with this poison must succeed on a DC 14 Constitution saving throw or be poisoned for 1 hour and blinded while poisoned in this way. A lesser restoration spell or similar magic ends the effect."
"Fargab","DSotDQ","188","none","adventuring gear","","","","","","","These backpack-sized devices are created in pairs, with matching numbers engraved on them, and allow communication over a long distance using radio frequencies. While wearing a fargab, you can use an action to speak into the device's mouthpiece and send a short message of twenty-five words or less to another creature wearing the matched fargab while it is within 18 miles of you. The message emits from the speakers of the device and can be heard up to 10 feet away from the device. If no creature is wearing the fargab, the speakers make static noises instead."
"Feed (per day)","PHB'24","230","none","tack and harness","","","","","10 lb.","5 cp",""
"Feywild Trinket","WBtW","7","none","adventuring gear","","","","","","","The Feywild Trinkets table that follows offers a selection of trinkets appropriate for Feywild-themed adventures such as this one. Players whose characters have the feylost or Witchlight hand background can roll on this table instead of the Trinkets table in the Player's Handbook to determine what trinkets their characters possess. The adventure includes a few encounters that require you to roll on the table to determine what random trinkets the characters find in key locations.Feywild Trinketsd100Trinket01Cookie cutter shaped like a unicorn02Two yew rings linked together03Silver hand mirror with a nymph-shaped handle04Painted wooden key whose teeth change configuration every day at dawn05Delicate silver cameo with pictures of twin children opposite one another06Golden pendant charm shaped like a leprechaun07Tiny wooden box containing a croquet set sized for pixies or sprites08Tiny pair of sharp, iron scissors09Chess piece shaped like a dancing satyr wearing a bishop's hat and clutching a gnarled staff10Saltshaker shaped like a wizard's tower11Crystal orb that allows an elf who holds it to sleep12Pendant that shows the phases of the moon13Large iron fingernail14Tiny electrum whistle that only Fey can hear15Wooden jigsaw puzzle piece as big as a saucer, with a painted image of a jug on it16Spool of glistening silver thread17Sheet of music that goblins find upsetting when they hear it played or sung18Rotten ogre's tooth with the Elvish glyph for ""moon"" etched into it19Vitrified eye of a displacer beast20Tiny duskwood coffin containing the ashes of a troll21Old invitation to a banquet in the Summer Court, written in ink on vellum in Sylvan22Gossamer shawl that glows faintly in moonlight23Ball-and-cup toy that plays a short, victorious jingle whenever the ball lands in the cup24Sprite's skull covered in ink fingerprints25Silver fork with the outer tines bent sideways26A soot-stained sock in which a nugget of coal magically appears each day at dawn27Tiny wooden stool (sized for a pixie or sprite) that gives splinters to those who hold it28Tiny clockwork dragonfly that slowly beats its wings (but can't fly) when wound up29Toy unicorn made of wood, painted with bright colors30Pixie plushie that sings when you squeeze it311-inch-square painting of a sleeping elf32Thimble that helps you daydream when worn33Pumpkin cupcake that magically regenerates itself in its paper cup each day at dawn34Fake Three-Dragon Ante card depicting a faerie dragon35Teacup made from a varnished mushroom cap that magically keeps its liquid contents lukewarm36Rock that floats and is small enough to hide in your closed fist37Tiny bottle filled with rainwater collected from the Feywild38Opalescent conch shell that laughs when you hold it to your ear39Vial of viscous liquid labeled ""Fomorian spit. Do not drink!""40Wax candle that roars and crackles like a bonfire while lit41Potted daffodil that sways when near a source of music428-ounce, glass wine bottle that magically reassembles itself 1 minute after being broken43Tiny wooden sylph figurehead from a model ship44Tiny pumpkin-shaped cauldron carved out of bog oak45Bar of soap that smells like something memorable from your childhood46Piece of orange parchment folded to look like a knight astride a unicorn47Tinted glasses so dark that they can't be seen through488-inch-long glass ant figurine49Piece of parchment bearing a child's drawing of an oni50Tiny hourglass without sand in it51Empty vial with corked ends at the top and bottom52Pair of green leprechaun boots tied together by their laces53Smoking pipe made from a tree root54Red cap that droops down to one's shoulders when worn55Mask that helps you remember your dreams if you wear it while you sleep56Notebook that shows what's written on it only when held upside down57Wooden top with four sides, each bearing the image of child enjoying a different season58Tiny beehive wig made for sprites or pixies59Wooden mouse figurine that squeaks when held60Stuffed oni doll with a creepy smile and one missing eye61Empty bag labeled ""Candy""62Tinted glass monocle that makes things look green63Black executioner's hood sized for a pixie or sprite64Piano key carved from a satyr's horn65Tiny wooden lute with cat hairs for strings66Iron needle with an eye that refuses to let thread pass through it67Tiny sundial that casts a shadow only in moonlight68Wooden pan flute that attracts harmless local fauna when played69Silvered pinecone70Flask of spectral glowworms that change color to reflect the mood of the flask's holder71Wooden apple painted blue72Tuning fork that sounds the tone for the F key73Nunchaku sized for a pixie or sprite74Copper coin with a smiling satyr's face on one side and a satyr's skull on the other75Severed chicken's foot attached to a leather cord76Collection of baby teeth in a tiny wooden box77Pinwheel whirligig that spins even when there's no wind78Child's parasol covered in moss and leaves79Wooden magnifying glass missing its lens80Glossy mushroom with a red, bell-shaped cap that jingles when shook81Pouch of seeds that smell like home82Petrified robin's egg83Wooden spoon with a hole in the center84Paper wasp nest in a jar85Sprig of rosemary wrapped with ribbon at one end86Tiny, unfurnished dollhouse sized for a pixie child87Paintbrush made entirely of ceramic—even the bristles88Candlestick whose candlelight looks like a tiny, dancing fairy made of fire89Spectacle frames in the shape of butterfly wings90Set of false wooden teeth91Tiny book of fairytales92Rucksack in which one potato magically appears each day at dawn93Pixie's winter jacket lined with fox fur94Tasseled wine charm shaped like a sprite95Weak magnetic wand96100-sided die the size of a plum, cut from coal97Glass slipper, missing its mate98Tiny dreamcatcher99Barbell sized for a pixie or sprite100Music box that plays a sprightly tune you remember from your childhood"
"Fine Clothes","PHB'24","225","none","adventuring gear","","","","","6 lb.","15 gp","Fine Clothes are made of expensive fabrics and adorned with expertly crafted details. Some events and locations admit only people wearing these clothes."
"Fine Wine (bottle)","PHB'24","231","none","food and drink","","","","","","10 gp",""
"Firearm Bullet","PHB'24","222","none","ammunition","","","","","⅕ lb.","3 sp","The ammunition of a firearm is destroyed upon use.Firearm Bullets are typically stored in a Pouch (bought separately)."
"Firearm Bullets (10)","PHB'24","222","none","ammunition","","","","","2 lb.","3 gp","The ammunition of a firearm is destroyed upon use.Firearm Bullets are typically stored in a Pouch (bought separately)."
"Fishing Tackle","PHB'14","151","none","adventuring gear","","","","","4 lb.","1 gp","This kit includes a wooden rod, silken line, corkwood bobbers, steel hooks, lead sinkers, velvet lures, and narrow netting."
"Flail","PHB'24","215","none","weapon, martial weapon, melee weapon","","1d8 Bludgeoning","","Mastery: Sap","2 lb.","10 gp","Mastery: Sap. If you hit a creature with this weapon, that creature has Disadvantage on its next attack roll before the start of your next turn."
"Flask","PHB'24","225","none","adventuring gear","","","","","1 lb.","2 cp","A Flask holds up to 1 pint."
"Flensing Claws","VGM","81","unknown","other","","","","","","","Illithids don't always provide their thralls with normal weapons, such as swords and axes. Sometimes they improve the natural capabilities of thralls by giving them new anatomy. Flensing claws take the form of articulated digits that extend into long metal blades. The claws are knitted into the flesh and bones of a creature's arms and can't be removed without surgical amputation.Each set of flensing claws is designed for a specific creature and can't be used by anyone else. A creature equipped with flensing claws can use its action to make one melee weapon attack with the claws. The claws deal slashing damage based on the creature's size. The creature adds its proficiency bonus and Strength modifier to any attack roll made with the claws, and its Strength modifier to its damage roll when it hits a target with the claws. Tiny and Gargantuan creatures can't be fitted with flensing claws.Multiple variations of this item exist, as listed below:Flensing Claws (Small)Flensing Claws (Medium)Flensing Claws (Large)Flensing Claws (Huge)"
"Flensing Claws (Huge)","VGM","81","unknown","other","","2d8 Slashing","","","","","Flensing claws take the form of articulated digits that extend into long metal blades. The claws are knitted into the flesh and bones of a creature's arms and can't be removed without surgical amputation.Each set of flensing claws is designed for a specific creature and can't be used by anyone else. A creature equipped with flensing claws can use its action to make one melee weapon attack with the claws. The creature adds its proficiency bonus and Strength modifier to any attack roll made with the claws, and its Strength modifier to its damage roll when it hits a target with the claws."
"Flensing Claws (Large)","VGM","81","unknown","other","","1d12 Slashing","","","","","Flensing claws take the form of articulated digits that extend into long metal blades. The claws are knitted into the flesh and bones of a creature's arms and can't be removed without surgical amputation.Each set of flensing claws is designed for a specific creature and can't be used by anyone else. A creature equipped with flensing claws can use its action to make one melee weapon attack with the claws. The creature adds its proficiency bonus and Strength modifier to any attack roll made with the claws, and its Strength modifier to its damage roll when it hits a target with the claws."
"Flensing Claws (Medium)","VGM","81","unknown","other","","1d10 Slashing","","","","","Flensing claws take the form of articulated digits that extend into long metal blades. The claws are knitted into the flesh and bones of a creature's arms and can't be removed without surgical amputation.Each set of flensing claws is designed for a specific creature and can't be used by anyone else. A creature equipped with flensing claws can use its action to make one melee weapon attack with the claws. The creature adds its proficiency bonus and Strength modifier to any attack roll made with the claws, and its Strength modifier to its damage roll when it hits a target with the claws."
"Flensing Claws (Small)","VGM","81","unknown","other","","1d8 Slashing","","","","","Flensing claws take the form of articulated digits that extend into long metal blades. The claws are knitted into the flesh and bones of a creature's arms and can't be removed without surgical amputation.Each set of flensing claws is designed for a specific creature and can't be used by anyone else. A creature equipped with flensing claws can use its action to make one melee weapon attack with the claws. The creature adds its proficiency bonus and Strength modifier to any attack roll made with the claws, and its Strength modifier to its damage roll when it hits a target with the claws."
"Flour","DMG'24","213","none","trade good","","","","","2 lb.","2 cp","Merchants commonly exchange trade goods without using currency."
"Flute","PHB'24","221","none","instrument","","","","","1 lb.","2 gp","Ability: CharismaUtilize: Play a known tune (DC 10), or improvise a song (DC 15)If you have proficiency with a tool, add your Proficiency Bonus to any ability check you make that uses the tool. If you have proficiency in a skill that's used with that check, you have Advantage on the check too."
"Flying Fish Ship","AAG","30","none","vehicle (space)","","Speed: 4½ mphCarrying Capacity: 13 tons cargoCrew 10, AC 15, HP 250, Damage Threshold 15","","","","20,000 gp","Aside from space galleons, flying fish ships are the most common vessels in Wildspace, favorites among merchants and adventurers alike.A flying fish ship can float and sail on water, but it isn't built to land on the ground (the ventral fins would snap under the weight of the ship during landing, and the keel would cause the ship to roll to one side).Typical weapons on a flying fish ship include a forward-mounted mangonel and an aft-mounted ballista."
"Forgery Kit","PHB'24","221","none","tool","","","","","5 lb.","15 gp","Ability: DexterityUtilize: Mimic 10 or fewer words of someone else's handwriting (DC 15), or duplicate a wax seal (DC 20)If you have proficiency with a tool, add your Proficiency Bonus to any ability check you make that uses the tool. If you have proficiency in a skill that's used with that check, you have Advantage on the check too."
"Frostfell and Everice Trinket","ERLW","136","none","adventuring gear","","","","","","","Trinkets from the Frostfell and Evericed8Trinket1A small prism carved from ice that doesn't melt2A rusted iron coin, depicting a dwarf lord and the worlds ""Five Rex Undra""3A pair of eight-sided dice carved from ice that doesn't melt4A swatch of silvery fur that's cold to the touch, possibly from a winter wolf5A snowball; it doesn't melt and can't be compressed into ice6A tiny white dragon sculpted from ice that doesn't melt7A key carved from ice that doesn't melt8A single scale from a white dragon"
"Galley","PHB'24","230","none","vehicle (water)","","Speed: 4 mphCarrying Capacity: 150 tons cargoCrew 80, AC 15, HP 500, Damage Threshold 20","","","","30,000 gp","Speed. A ship sailing against a strong wind moves at half speed. In a dead calm (no wind), waterborne ships can't move under sail and must be rowed. Keelboats and Rowboats are used on lakes and rivers. If going downstream, add the speed of the current (typically 3 miles per hour) to the speed of the vehicle. These vehicles can't be rowed against any significant current, but they can be pulled upstream by draft animals on the shores. A Rowboat can be carried and weighs 100 pounds. Crew. A ship larger than a Keelboat or Rowboat needs a crew of skilled hirelings (see ""Services"") to function. The minimum number of skilled hirelings needed to crew a ship depends on the type of ship. Passengers. The number of Small and Medium passengers the ship can accommodate using hammocks. A ship outfitted with private accommodations can carry one-fifth as many passengers. A passenger usually pays 5 SP per day for a hammock, but prices can vary from ship to ship. A small private cabin usually costs 2 GP per day. Damage Threshold. See the rules glossary. Ship Repair. Repairs to a damaged ship can be made while the vessel is berthed. Repairing 1 Hit Point of damage requires 1 day and costs 20 GP for materials and labor. If the repairs are made in a location where supplies and skilled labor are abundant, such as a city shipyard, the repair time and cost are halved."
"Gaming Set","PHB'24","221","none","gaming set","","","","","","","If you have proficiency with a tool, add your Proficiency Bonus to any ability check you make that uses the tool. If you have proficiency in a skill that's used with that check, you have Advantage on the check too.Multiple variations of this item exist, as listed below:Dice SetDragonchess SetPlaying CardsThree-Dragon Ante Set"
"Gate Warden Trinket","SatO","7","none","adventuring gear","","","","","","","d6Trinket1A tiny vial pendant filled with a drop of honey that glows faintly2A small lead ingot that has a strange thumbprint pressed into it and whispers when held tightly3Two lodestone spheres that chime when they attract each other4A smoldering pebble of coal that, while always hot, doesn't burn skin, fur, scales, or clothing5A feather that sheds dim light in a 5-foot radius6A ring made from a chain link that, once donned, won't come off without pulling painfully hard"
"Giant Trinket","BGG","16","none","adventuring gear","","","","","","","While exploring your home, you discovered some trivial remnant of the ancient inhabitants, as determined by rolling on the Giant Trinkets table. The items in parentheses are the normal-sized objects most analogous to the described giant trinkets.Giant Trinketsd6Giant Trinket1A giant's toothpick (a dagger)2A giant's handkerchief (a blanket)3A giant's marble (a crystal orb)4A giant's match (a torch)5A giant's letter opener (a longsword)6A giant's thimble (an iron pot)"
"Ginger","DMG'24","213","none","trade good","","","","","1 lb.","1 gp","Merchants commonly exchange trade goods without using currency."
