"Name","Source","Page","Rarity","Type","Attunement","Damage","Properties","Mastery","Weight","Value","Text"
"Abacus","PHB'14","150","none","adventuring gear","","","","","2 lb.","2 gp",""
"Acid","PHB'24","222","none","adventuring gear","","","","","1 lb.","25 gp","When you take the Attack action, you can replace one of your attacks with throwing a vial of Acid. Target one creature or object you can see within 20 feet of yourself. The target must succeed on a Dexterity saving throw (DC 8 plus your Dexterity modifier and Proficiency Bonus) or take 2d6 Acid damage."
"Adamantine Ammunition","XGE","78","unknown","ammunition, generic variant","","","","","","","Ammunition made of or coated with adamantine is unusually effective when used to break objects. Whenever a piece of adamantine ammunition hits an object, the hit is a critical hit.The adamantine version of ten pieces of ammunition costs 500 gp more than the normal version, whether the ammunition is made of the metal or coated with it. Base items. This item variant can be applied to the following base items:Arrow (Adamantine Arrow)Bolt (Adamantine Bolt)Firearm Bullet (Adamantine Firearm Bullet)Needle (Adamantine Needle)Sling Bullet (Adamantine Sling Bullet)"
"Adamantine Bar","WDH","90","none","trade good","","","","","10 lb.","1,000 gp","Most wealth is not in coins. It is measured in livestock, grain, land, rights to collect taxes, or rights to resources (such as a mine or a forest).Guilds, nobles, and royalty regulate trade. Chartered companies are granted rights to conduct trade along certain routes, to send merchant ships to various ports, or to buy or sell specific goods. Guilds set prices for the goods or services that they control, and determine who may or may not offer those goods and services. Merchants commonly exchange trade goods without using currency."
"Adjustable Stilts","WDH","47","unknown","other","","","","","8 lb.","","The stilts take 1 minute to put on or remove. They increase the height of any humanoid wearing them by 2 to 5 feet. Each stilt weighs 8 pounds and is 1 foot long when fully collapsed."
"Aerenal Trinket","ERLW","134","none","adventuring gear","","","","","","","Trinkets from Aerenald8Trinket1A bronzewood ring inscribed with the Elvish word for ""hope""2A dried flower; if it's placed in water, it blooms3An ebony locket; when it's opened, an elven voice whispers ""Always""4A tiny skull carved from dark wood5A finger bone inscribed with an unknown sigil6An ivory flute which produces no sound7A small journal made from preserved leaves8A book of poetry written by undead elves"
"Airship","PHB'24","230","none","vehicle (air)","","Speed: 8 mphCarrying Capacity: 1 ton cargo, 20 passengersCrew 10, AC 13, HP 300","","","","40,000 gp","Speed. A ship sailing against a strong wind moves at half speed. In a dead calm (no wind), waterborne ships can't move under sail and must be rowed. Keelboats and Rowboats are used on lakes and rivers. If going downstream, add the speed of the current (typically 3 miles per hour) to the speed of the vehicle. These vehicles can't be rowed against any significant current, but they can be pulled upstream by draft animals on the shores. A Rowboat can be carried and weighs 100 pounds. Crew. A ship larger than a Keelboat or Rowboat needs a crew of skilled hirelings (see ""Services"") to function. The minimum number of skilled hirelings needed to crew a ship depends on the type of ship. Passengers. The number of Small and Medium passengers the ship can accommodate using hammocks. A ship outfitted with private accommodations can carry one-fifth as many passengers. A passenger usually pays 5 SP per day for a hammock, but prices can vary from ship to ship. A small private cabin usually costs 2 GP per day. Damage Threshold. See the rules glossary. Ship Repair. Repairs to a damaged ship can be made while the vessel is berthed. Repairing 1 Hit Point of damage requires 1 day and costs 20 GP for materials and labor. If the repairs are made in a location where supplies and skilled labor are abundant, such as a city shipyard, the repair time and cost are halved."
"Alchemist's Doom","SCC","179","unknown","adventuring gear","","","","","1 lb.","","This sticky, adhesive fluid ignites when exposed to air. As an action, you can throw this flask up to 20 feet, shattering it on impact. Make a ranged attack against a creature or object, treating the alchemist's doom as an improvised weapon. On a hit, the target takes 7 (2d6) fire damage at the start of each of its turns. A creature can end this damage by using its action to make a DC 10 Dexterity check to extinguish the flames."
"Alchemist's Fire","PHB'24","222","none","adventuring gear","","","","","1 lb.","50 gp","When you take the Attack action, you can replace one of your attacks with throwing a flask of Alchemist's Fire. Target one creature or object you can see within 20 feet of yourself. The target must succeed on a Dexterity saving throw (DC 8 plus your Dexterity modifier and Proficiency Bonus) or take 1d4 Fire damage and start burning."
"Alchemist's Supplies","PHB'24","220","none","artisan's tools","","","","","8 lb.","50 gp","Ability: IntelligenceUtilize: Identify a substance (DC 15), or start a fire (DC 15)Craft: Acid, Alchemist's Fire, Component Pouch, Oil, Paper, PerfumeArtisan's Tools are each focused on crafting items and pursuing a trade. Each type of Artisan's Tools tools requires a separate proficiency.If you have proficiency with a tool, add your Proficiency Bonus to any ability check you make that uses the tool. If you have proficiency in a skill that's used with that check, you have Advantage on the check too."
"Ale (gallon)","PHB'14","158","none","food and drink","","","","","","2 sp",""
"Ale (mug)","PHB'24","231","none","food and drink","","","","","","4 cp",""
"Amulet","PHB'24","226","none","spellcasting focus","","","","","1 lb.","5 gp","For an Amulet to be an effective Holy Symbol, it must be worn or held.A Holy Symbol takes a specific form and is bejeweled or painted to channel divine magic. A Cleric or Paladin can use a Holy Symbol as a Spellcasting Focus."
"Antitoxin","PHB'24","222","none","adventuring gear","","","","","","50 gp","As a Bonus Action, you can drink a vial of Antitoxin to gain Advantage on saving throws to avoid or end the Poisoned condition for 1 hour."
"Arcane Focus","PHB'24","224","none","spellcasting focus","","","","","","","An Arcane Focus takes a specific form and is bejeweled or carved to channel arcane magic. A Sorcerer, Warlock, or Wizard can use such an item as a Spellcasting Focus.Multiple variations of this item exist, as listed below:CrystalOrbRodStaffWand"
"Argonnessen Trinket","ERLW","134","none","adventuring gear","","","","","","","Trinkets from Argonnessend10Trinket1A pierced dragon scale on a cord2A statuette of a dragon carved from black bone3A dragon's tooth, engraved with an unknown sigil4A child's doll of a dragon, woven from leather cords5A dagger carved from a dragon's talon6A brass disk bearing the silhouette of a black dragon7A small egg-shaped piece of polished bone8A bone fragment with brass inlaid runes9A leather pouch filled with tiny draconic teeth10A single large seed that's warm to the touch"
"Arrow","PHB'24","222","none","ammunition","","","","","0.8 oz.","5 cp","Arrows are used with a weapon that has the ammunition property to make a ranged attack. Each time you attack with the weapon, you expend one piece of ammunition. Drawing the ammunition from a quiver, case, or other container is part of the attack (you need a free hand to load a one-handed weapon). At the end of the battle, you can recover half your expended ammunition by taking a minute to search the battlefield.Arrows are typically stored in a Quiver (bought separately)."
"Arrows (20)","PHB'24","222","none","ammunition","","","","","1 lb.","1 gp","Arrows are used with a weapon that has the ammunition property to make a ranged attack. Each time you attack with the weapon, you expend one piece of ammunition. Drawing the ammunition from a quiver, case, or other container is part of the attack (you need a free hand to load a one-handed weapon). At the end of the battle, you can recover half your expended ammunition by taking a minute to search the battlefield.Arrows are typically stored in a Quiver (bought separately)."
"Artisan's Tools","PHB'24","220","none","artisan's tools","","","","","","","Artisan's Tools are each focused on crafting items and pursuing a trade. Each type of Artisan's Tools tools requires a separate proficiency.If you have proficiency with a tool, add your Proficiency Bonus to any ability check you make that uses the tool. If you have proficiency in a skill that's used with that check, you have Advantage on the check too.Multiple variations of this item exist, as listed below:Alchemist's SuppliesBrewer's SuppliesCalligrapher's SuppliesCarpenter's ToolsCartographer's ToolsCobbler's ToolsCook's UtensilsGlassblower's ToolsJeweler's ToolsLeatherworker's ToolsMason's ToolsPainter's SuppliesPotter's ToolsSmith's ToolsTinker's ToolsWeaver's ToolsWoodcarver's Tools"
"Assassin's Blood","DMG'24","90","none","adventuring gear, poison (ingested)","","","","","","150 gp","A creature subjected to Assassin's Blood makes a DC 10 Constitution saving throw. On a failed save, the creature takes 6 (1d12) Poison damage and has the Poisoned condition for 24 hours. On a successful save, the creature takes half as much damage only."
"Axe Beak","IDRotF","20","none","mount","","","","","","50 gp","An axe beak's splayed toes allow it to run across snow, and it can carry as much weight as a mule. A domesticated axe beak can be purchased in Ten-Towns for 50 gp."
"Backpack","PHB'24","224","none","adventuring gear","","","","","5 lb.","2 gp","A Backpack holds up to 30 pounds within 1 cubic foot. It can also serve as a saddlebag."
"Backpack Parachute","WDH","47","unknown","other","","","","","","","A humanoid wearing this piece of gear can deploy the parachute as a reaction while falling, or as an action otherwise. The parachute requires at least a 10-foot cube of unoccupied space in which to deploy, and it doesn't open fast enough to slow a fall of less than 60 feet. If it has sufficient time and space to deploy properly, the parachute allows its wearer to land without taking falling damage. Once it has been used, the parachute takes 10 minutes to repack."
"Bagpipes","PHB'24","221","none","instrument","","","","","6 lb.","30 gp","Ability: CharismaUtilize: Play a known tune (DC 10), or improvise a song (DC 15)If you have proficiency with a tool, add your Proficiency Bonus to any ability check you make that uses the tool. If you have proficiency in a skill that's used with that check, you have Advantage on the check too."
"Ball Bearing","PHB'14","151","none","adventuring gear","","","","","0.032 oz.","0.1 cp","Most commonly found inside a bag of ball bearings."
"Ball Bearings","PHB'24","224","none","adventuring gear","","","","","2 lb.","1 gp","As a Utilize action, you can spill Ball Bearings from their pouch. They spread to cover a level, 10-foot-square area within 10 feet of yourself. A creature that enters this area for the first time on a turn must succeed on a DC 10 Dexterity saving throw or have the Prone condition. It takes 10 minutes to recover the Ball Bearings."
"Barding","PHB'14","157","none","tack and harness","","","","","base weight ×2","base value ×4","Barding is armor designed to protect an animal's head, neck, chest, and body. Any type of armor shown on the Armor table in this chapter can be purchased as barding. The cost is four times the equivalent armor made for humanoids, and it weighs twice as much. Base items. This item variant can be applied to the following base items:Breastplate (Breastplate Barding)Chain Mail (Chain Mail Barding)Chain Shirt (Chain Shirt Barding)Half Plate Armor (Half Plate Barding)Hide Armor (Hide Barding)Leather Armor (Leather Barding)Padded Armor (Padded Barding)Plate Armor (Plate Barding)Ring Mail (Ring Mail Barding)Scale Mail (Scale Mail Barding)Spiked Armor (Spiked Barding)Splint Armor (Splint Barding)Studded Leather Armor (Studded Leather Barding)"
"Barking Box","WDH","47","unknown","other","","","","","","","This metal cube, 6 inches on a side, has a crank on top. Using an action to wind the crank activates the box for 8 hours. While activated, the box barks whenever it detects vibrations within 15 feet of it, as long as the box and the source of the vibrations are in contact with the same ground or substance. A switch on one side of the box sets the device to emit either a small dog's bark or a large dog's bark."
"Barrel","PHB'24","224","none","adventuring gear","","","","","70 lb.","2 gp","A Barrel holds up to 40 gallons of liquid or up to 4 cubic feet of dry goods."
"Barrier Peaks Trinket","LLK","7","none","adventuring gear","","","","","","","At any point while the characters are searching through unusual equipment or detritus in the Monastery of the Distressed Body or the city of Daoine Gloine, roll on the following table to determine what they find. Each character finds one Barrier Peaks trinket over the course of the adventure.Barrier Peaks Trinketsd100Trinket01-02A handheld device containing a glowing green gem that darkens when no oxygen is present03-04A foot-long, egg-shaped object made from stitched leather05-06A black metal cylinder that dictates the history of an unknown plant or animal species when held07-08A cylindrical jar containing a pickled crustacean of unknown origin09-10A small thumb-button storage cylinder that releases a useless iron key when pressed11-12An unusual heraldic cloak pin that emits a short musical fanfare when tapped13-14A handheld tube that sucks in dust when squeezed and captures it in a detachable compartment15-16A scintillating disk of unknown material17-18A dial that can be twisted to slowly click back to its origin, whereupon it emits a loud ringing noise19-20A hovering, apple-sized orb of metal that follows you around21-22The petrified cocoon of an unknown insect23-24A bronze gauntlet set with many slots, and which violently expels any object pressed into those slots25-26A box that plays an illusory message in an unknown language when opened27-28A rod that causes you to forget the last five minutes when you press a button near its tip29-30A palm-sized cylinder that emits a harmless ray of glowing blue light when squeezed31-32A bead that suppresses your hearing when secreted inside either ear, causing you to be deafened33-34An amulet that displays your current health as a green bar above your head, with the bar retracting as your hit point total decreases35-36A casket containing one hundred tasteless blue pills that produce no discernible effect when swallowed37-38A metal mechanical puzzle with no apparent solution39-40A metal spinning top that never tips over when spun41-42Two strips of cloth-like material, each coated with a soft, hair-like fuzz on one side43-44A simple wire pyramid that preserves any foodstuffs it is placed over45-46A star chart labeled in an unknown script47-48A rectangle of black glass that displays indecipherable arcane runes when you swipe your finger across it49-50A schematic that shows the inner workings of an impossibly complex device51-52An odd pair of comfortable shoes made from supple, multicolored material53-54A mirror that makes you appear more beautiful when you tap your reflection55-56A mechanical metal puppy that playfully follows you around when activated57-58A talking bracelet that speaks only to correct your grammar59-60A bar of soap that can remove any stain61-62A journal in Common, written by someone in a world similar to but not quite the same as your own63-64A tub containing one serving of disgusting but nutritious goop that refills itself slowly over the course of one week65-66An instruction manual for activating a mysterious, world-destroying device67-68A small supple disk that displays weird moving symbols when placed over either eye69-70A tiny desk set with large, colorful buttons, each of which plays a discordant musical fanfare when pressed71-72A pair of tinted spectacles that reduce the glare of the sun when worn73-74An inflatable bedroll made from an unknown material, and which slowly deflates when used75-76A rod tipped with a blunt metal pincer whose grip can be adjusted by turning a screw77-78A battered helmet with a transparent orange visor that flips into place when donned79-80An animated map of a mysterious city that appears to be tracking the movements of five creatures81-82A cylinder of mist that holds your hair perfectly in shape when sprayed onto your head83-84A talking wand that tells you the name of any plant you point it at85-86A metal bracelet that displays the number of steps you've taken since your last long rest87-88A tiny handheld device that projects a glowing dot onto whatever you point it at89-90A rectangular piece of glass that displays a twelve-digit countdown on its surface91-92A wall chart of mysterious formulae arranged into a color-coded grid93-94A handheld device that solves any math problem you input using its buttons95-96A ball of speckled brown fur that appears to be alive97-98A complicated crystal board game that you don't know how to play99-00A large glass rectangle that displays a storm of black and white patterns when you press a button on its underside"
"Basic Fishing Equipment","AAG","21","none","adventuring gear","","","","","","1 sp","Basic Fishing Equipment includes a pole, a line, a hook, and either a lure or some bait.Fishing is a popular pastime in Wildspace and the Astral Sea, though this activity isn't possible aboard a ship that is moving faster than its flying speed. At the end of each hour spent fishing, a character can make a DC 15 Wisdom (Survival) check. A failed check indicates no fish is caught during that hour. On a successful check, roll a d10 and consult the Fishing table to determine the catch.d10Catch1-2Tiny, inedible fish (a creature that consumes it is poisoned for 1 hour)3-5Tiny, edible fish (feeds one person)6-8Small, edible fish (feeds up to four people)9Hostile space eel (see Boo's Astral Menagerie; feeds up to twelve people)10Hostile gray scavver (see Boo's Astral Menagerie; feeds up to twenty people), some other creature of the DM's choosing, or an Tiny object of the DM's choosing"
"Basic Poison","PHB'24","227","none","adventuring gear, poison","","","","","","100 gp","As a Bonus Action, you can use a vial of Basic Poison to coat one weapon or up to three pieces of ammunition. A creature that takes Piercing or Slashing damage from the poisoned weapon or ammunition takes an extra 1d4 Poison damage. Once applied, the poison retains potency for 1 minute or until its damage is dealt, whichever comes first."
"Basket","PHB'24","224","none","adventuring gear","","","","","2 lb.","4 sp","A Basket holds up to 40 pounds within 2 cubic feet."
"Battleaxe","PHB'24","215","none","weapon, martial weapon, melee weapon","","1d8 Slashing","Versatile (1d10)","Mastery: Topple","4 lb.","10 gp","Versatile. A Versatile weapon can be used with one or two hands. A damage value in parentheses appears with the property. The weapon deals that damage when used with two hands to make a melee attack. Mastery: Topple. If you hit a creature with this weapon, you can force the creature to make a Constitution saving throw (DC 8 plus the ability modifier used to make the attack roll and your Proficiency Bonus). On a failed save, the creature has the Prone condition."
"Bedroll","PHB'24","224","none","adventuring gear","","","","","7 lb.","1 gp","A Bedroll sleeps one Small or Medium creature. While in a Bedroll, you automatically succeed on saving throws against extreme cold (see the Dungeon Master's Guide)."
"Bell","PHB'24","224","none","adventuring gear","","","","","","1 gp","When rung as a Utilize action, a Bell produces a sound that can be heard up to 60 feet away."
"Birdpipes","SCAG","124","none","instrument","","","","","","","Pan pipes or satyr pipes, also known as the shalm, these are sacred to Lliira and popular with wood elf and wild elf bards.If you have proficiency with a given musical instrument, you can add your proficiency bonus to any ability checks you make to play music with the instrument. A bard can use a musical instrument as a spellcasting focus. Each type of musical instrument requires a separate proficiency.See the Tool Proficiencies entry for more information.Proficiency with a musical instrument indicates you are familiar with the techniques used to play it. You also have knowledge of some songs commonly performed with that instrument. History. Your expertise aids you in recalling lore related to your instrument. Performance. Your ability to put on a good show is improved when you incorporate an instrument into your act. Compose a Tune. As part of a long rest, you can compose a new tune and lyrics for your instrument. You might use this ability to impress a noble or spread scandalous rumors with a catchy tune.Musical InstrumentActivityDCIdentify a tune10Improvise a tune20"
"Bit and bridle","PHB'14","157","none","tack and harness","","","","","1 lb.","2 gp",""
"Biza's Breath","JttRC","70","none","adventuring gear, poison (inhaled)","","","","","","","A creature subjected to this poison must succeed on a DC 16 Constitution saving throw or become poisoned for 1 minute. The poisoned creature must use its action to make a melee attack against a randomly determined creature within its reach. If there is no other creature within its reach, the poisoned creature does nothing on its turn. The creature can repeat the saving throw at the end of each of its turns, ending the effect on itself on a success."
"Black Ghost Orchid Seed","JttRC","212","none","adventuring gear","","","","","","","Every few years, a ghost orchid colony grows a black pod as thick as a human fist that holds three soft, black seeds. A creature that consumes one of these black seeds is affected by the spell feign death. If the creature is unaware of the pod's effects or does not wish to be affected, it can resist the effect by succeeding on a DC 16 Constitution saving throw. Otherwise, it is considered to be a willing recipient of the spell."
"Black Sap","EGW","152","none","adventuring gear","","","","","","300 gp","This tarry substance harvested from the dark boughs of the death's head willow is a powerful intoxicant. It can be smoked as a concentrate or injected directly into the bloodstream. A creature subjected to a dose of black sap cannot be charmed or frightened for 1d6 hours.For each dose of black sap consumed, a creature must succeed on a DC 15 Constitution saving throw or become poisoned for 2d4 hours—an effect that is cumulative with multiple doses."
"Blanket","PHB'24","224","none","adventuring gear","","","","","3 lb.","5 sp","While wrapped in a blanket, you have Advantage on saving throws against extreme cold (see the Dungeon Master's Guide)."
"Blasting Powder","EGW","225","none","adventuring gear","","","","","","","This volatile alchemical powder comes in a small pouch. When ignited by an open flame or a fuse, the powder explodes. Each creature within 5 feet of the exploding pouch must make a DC 13 Dexterity saving throw, taking 3d6 bludgeoning damage on a failed save, or half as much damage on a successful one.A character can bind multiple pouches of blasting powder together so they explode at the same time. Each additional pouch increases the damage by 1d6 (maximum of 10d6) and the blast radius by 5 feet (maximum of 20 feet)."
"Blight Ichor","EGW","152","none","adventuring gear","","","","","","200 gp","This bitter chartreuse concoction is distilled from a fungus native to the Blightshore badlands. The sickly green liqueur harbors potent psychedelic properties. Provided it is neither a construct nor undead, a creature subjected to a dose of blight ichor gains advantage on Intelligence and Wisdom checks, as well as vulnerability to psychic damage, for 1 hour. For each dose of blight ichor consumed, the creature must succeed on a DC 15 Constitution saving throw or become poisoned for 1d6 hours and suffer the effects of a confusion spell for 1 minute. An undead creature subjected to a dose of blight ichor gains advantage on all Dexterity checks and is immune to the frightened condition for 1 hour."
"Block and Tackle","PHB'24","224","none","adventuring gear","","","","","5 lb.","1 gp","A Block and Tackle allows you to hoist up to four times the weight you can normally lift."
"Blood of the Lycanthrope","IMR","93","none","poison (injury)","","","","","","","This poison is created from blood harvested from a dead or incapacitated lycanthrope in its animal or hybrid form. A creature subjected to this poison must succeed on a DC 12 Constitution saving throw or be cursed with lycanthropy (see the Monster Manual). The curse lasts until removed by the remove curse spell or similar magic.The type of lycanthropy depends on the lycanthrope used to create the poison. To determine the type of lycanthropy randomly, roll a d6:d6Lycanthropy1-3Wererat4-5Werewolf6Wereboar"
